{
  "changed_files": [
    "src/ai_workflow/execution.py",
    "tests/test_task_projection.py",
    "reactjs/rules/project-structure.md",
    "reactjs/skills/create-react-monorepo-frontend/SKILL.md",
    "reactjs/skills/create-react-monorepo-frontend/references/dependency-runtime.md",
    "reactjs/skills/verify-react-delivery/SKILL.md"
  ],
  "checks": [
    {
      "name": "pytest",
      "reason": "169 passed in 46.44s in an isolated checkout containing changed files and all behavior packs; missing optional packs restored from local git archives at exact recorded revisions.",
      "status": "passed"
    },
    {
      "name": "ruff",
      "reason": "ruff check . passed.",
      "status": "passed"
    },
    {
      "name": "skill-validation",
      "reason": "Both modified skills passed skill-creator quick_validate.py.",
      "status": "passed"
    },
    {
      "name": "mypy",
      "reason": "Two pre-existing no-any-return errors in execution.py lines 206 and 207. Reproduced against HEAD in separate baseline source snapshot; no new type errors.",
      "status": "failed"
    },
    {
      "name": "diff-whitespace",
      "reason": "git diff --check passed for workflow and React submodule.",
      "status": "passed"
    }
  ],
  "feature_id": "maintenance-docker-frontend-recovery",
  "requirement_ids": [
    "WF-001"
  ],
  "reviews": [
    {
      "at": "2026-09-16T18:07:02.718714Z",
      "independent": false,
      "limitations": [
        "Existing baseline mypy failures remain."
      ],
      "scope": "Local .agents workflow and its React behavior submodule; no application generation, deployment, remote push or gate approval.",
      "status": "READY_FOR_VERIFICATION"
    }
  ],
  "verified": false
}
